麻黄山风电场一期49.5MW工程,风电,2010/9/17,2010,49.5,115.1088,31.5633,并网,河南省,阿克苏地区,温宿县,托乎拉乡
乌什龙柏20MWP光伏并网发电项目,光伏,,,20,79.23333333,41.21666667,核准,新疆维吾尔自治区,阿克苏地区,乌什县,乌什镇
麻黄山风电场二期49.5MW工程,风电,2010/11/30,2010,49.5,112.2553,34.5113,并网,河南省,阿克苏地区,乌什县,阿合雅镇
麻城纯阳山80MW风电场工程,风电,2017/3/27,2017,80,115.0917619,31.18934112,并网,湖北省,阿克苏地区,乌什县,阿合雅镇
绿叶内黄县后河镇余庄村分散式风电项目,风电,2019/3/23,2019,6,114.82,35.97,并网,河南省,阿克苏地区,乌什县,阿合雅镇
绿象科技遵义团溪风电48MW工程项目,风电,2019/5/28,2019,48,106.8504149,27.62040291,并网,贵州省,乌鲁木齐市,水磨沟区,七道湾街道
绿港一期分布式风电场项目,风电,2018/5/18,2018,7.4,120.1501667,31.918,并网,江苏省,吐鲁番市,托克逊县,伊拉湖镇
绿港二期分布式风电场项目,风电,2018/12/31,2018,13.8,120.1333333,31.92183333,并网,江苏省,巴彦淖尔市,乌拉特后旗,潮格温都尔镇
洛阳宜阳樊村风电场项目,风电,2015/4/27,2015,48,112.17,34.52,并网,河南省,巴彦淖尔市,乌拉特中旗,甘其毛都镇
罗平山风电场一期项目,风电,2010/12/25,2010,48.75,100.0791292,26.22819536,并网,云南省,乌兰察布市,卓资县,卓资山镇
乌兰益多新能源有限公司乌兰20兆瓦并网光伏发电项目,光伏,,,20,98.52375325,36.84872143,核准,青海省,海西蒙古族藏族自治州,乌兰县,铜普镇
鹿邑县100MW风电项目,风电,2020/1/17,2020,100,115.08,33.98,并网,河南省,海西蒙古族藏族自治州,乌兰县,铜普镇
陆丰市甲东30MW风电场,风电,2006/7/4,2006,30.4,115.4506923,23.04831798,并网,广东省,乌兰察布市,兴和县,城关镇
乌兰县润晟新能源有限公司乌兰10万千瓦风电项目,风电,,,100,98.21666667,36.83333333,核准,青海省,海西蒙古族藏族自治州,乌兰县,柯柯镇
陆丰甲湖风电场工程,风电,2009/10/19,2009,48,115.4505384,23.10504833,并网,广东省,海西蒙古族藏族自治州,乌兰县,铜普镇
鲁能榆林靖边烟墩山风电场,风电,2017/4/25,2017,50,108.828176,37.78505769,并网,陕西省,海西蒙古族藏族自治州,乌兰县,希里沟镇
鲁能新疆小草湖风电场一期49.5兆瓦建设项目,风电,2013/12/31,2013,49.5,89.18794035,42.95102809,并网,新疆维吾尔自治区,海西蒙古族藏族自治州,乌兰县,希里沟镇
鲁能宁夏盐池于家梁风电项目,风电,2018/9/30,2018,100,107.486,37.32,并网,陕西省,兴安盟,乌兰浩特市,铁西街道
鲁能康保屯垦100MW风电场工程,风电,2010/8/7,2010,100.5,114.5167,41.8667,并网,河北省,兴安盟,科尔沁右翼前旗,呼和马场
鲁能发展集团有限公司乳山42兆瓦风力发电项目,风电,2010/6/30,2010,42,121.5673681,36.90943695,并网,山东省,乌兰察布市,商都县,十八顷镇
鲁能东营48MW风电项目,风电,2009/12/26,2009,48,118.4909978,37.97896802,并网,山东省,乌兰察布市,卓资县,卓资山镇
鲁能承德丰宁北窝铺风电场一期建设项目,风电,2018/4/23,2018,48,116.7166667,41.55,并网,河北省,乌兰察布市,卓资县,卓资山镇
卢龙县卢龙镇风电场,风电,2018/12/1,2018,48,118.862,39.807,并网,河北省,乌兰察布市,商都县,三大顷乡
乌兰察布市万德鑫光伏能源察右后旗100MWP光伏地面电站项目,光伏,,,100,113.18,41.45,核准,内蒙古自治区,乌兰察布市,察哈尔右翼后旗,白音察干镇
隆回县望云山风电场工程项目,风电,2015/11/26,2015,50,111.02,27.52,并网,湖南省,乌兰察布市,四子王旗,乌兰花镇
龙源张掖甘州平山湖风电场二期项目,风电,2015/6/1,2015,49.5,100.5502267,39.15548872,并网,甘肃省,乌兰察布市,商都县,三大顷乡
乌兰察布市金能源风电察右后旗乌兰格尔一期50MWp太阳能发电项目,光伏,,,50,113.1849699,41.43598144,核准,内蒙古自治区,乌兰察布市,察哈尔右翼后旗,白音察干镇
龙源张家口尚义麒麟山风电场（增列）15万千瓦项目,风电,2015/12/31,2015,100,114.3057,41.1335,并网,河北省,乌兰察布市,察哈尔右翼后旗,白音察干镇
乌兰察布市迪盛昇察右后旗100MWp新能源与设施农业综合利用项目,光伏,,,100,113.1849699,41.43598144,核准,内蒙古自治区,乌兰察布市,察哈尔右翼后旗,白音察干镇
龙源玉林博白四方嶂风电场项目,风电,2020/1/12,2020,96.8,109.8314683,22.30254882,并网,广西壮族自治区,乌兰察布市,察哈尔右翼前旗,三岔口乡
龙源盐池西大井风电项目,风电,2019/9/30,2019,50,107.8666667,38.1,并网,内蒙古自治区,乌兰察布市,卓资县,卓资山镇
龙源盐池风电项目,风电,2015/12/29,2015,150,118.8667,31.1667,并网,安徽省,乌兰察布市,商都县,三大顷乡
龙源宣城南漪湖风电场项目,风电,2014/10/15,2014,49.5,118.52,31.1,并网,安徽省,乌兰察布市,察哈尔右翼前旗,三岔口乡
龙源宣城白马风电场项目,风电,2017/7/7,2017,48.3,118.8666667,30.16666667,并网,浙江省,乌兰察布市,察哈尔右翼后旗,白音察干镇
乌兰察布风电基地幸福第一风电场,风电,,,600,113.1456651,40.93004192,建设,内蒙古自治区,乌兰察布市,察哈尔右翼前旗,平地泉镇
乌兰察布风电基地幸福第二风电场,风电,,,700,113.1201451,40.96677192,建设,内蒙古自治区,乌兰察布市,集宁区,马莲渠乡
乌兰察布风电基地红格尔第一风电场,风电,,,700,113.1997851,40.94325192,建设,内蒙古自治区,乌兰察布市,察哈尔右翼前旗,黄旗海镇
乌兰察布风电基地红格尔第四风电场,风电,,,600,113.13376,40.99391,建设,内蒙古自治区,乌兰察布市,集宁区,马莲渠乡
乌兰察布风电基地红格尔第三风电场,风电,,,700,113.1708551,40.95853192,建设,内蒙古自治区,乌兰察布市,察哈尔右翼前旗,黄旗海镇
乌兰察布风电基地红格尔第二风电场,风电,,,500,113.1264651,40.99212192,建设,内蒙古自治区,乌兰察布市,集宁区,马莲渠乡
乌兰察布风电基地大板梁第一风电场,风电,,,400,113.1337553,40.99390354,建设,内蒙古自治区,乌兰察布市,集宁区,马莲渠乡
乌兰察布风电基地大板梁第四风电场,风电,,,600,113.1402584,40.99985432,建设,内蒙古自治区,乌兰察布市,集宁区,马莲渠乡
乌兰察布风电基地大板梁第三风电场,风电,,,500,113.1384651,40.92212192,建设,内蒙古自治区,乌兰察布市,察哈尔右翼前旗,平地泉镇
乌兰察布风电基地大板梁第二风电场,风电,,,700,113.1203651,40.99575192,建设,内蒙古自治区,乌兰察布市,集宁区,马莲渠乡
乌兰察布东生电力化德县德包图100.5MWp光伏发电项目,光伏,,,100.5,113.0833333,40.76666667,核准,内蒙古自治区,乌兰察布市,察哈尔右翼前旗,土贵乌拉镇
龙源兴和县小南营风电场49.5MW风电项目,风电,2018/8/1,2018,49.5,113.84,41.26,并网,内蒙古自治区,乌海市,乌达区,苏海图街道
龙源新疆阿拉山口风电场一期49.5兆瓦风电项目,风电,2010/12/20,2010,49.5,82.0478858,44.85383207,并网,新疆维吾尔自治区,巴彦淖尔市,乌拉特中旗,海流图镇
龙源新疆阿拉山口风电场二期49.5兆瓦风电项目,风电,2010/12/20,2010,49.5,121.2575,28.3773,并网,浙江省,包头市,达尔罕茂明安联合旗,巴音花镇
龙源天津汉沽洒金坨48兆瓦风电项目,风电,2018/2/1,2018,48,117.3598432,38.74412981,并网,天津市,巴彦淖尔市,乌拉特中旗,甘其毛都镇
乌拉特中旗百万千瓦风电基地蒙能与大唐国际合作开发乌兰5号风电场200MW风电项目,风电,,,200,109.679,42.583,核准,内蒙古自治区,包头市,达尔罕茂明安联合旗,巴音花镇
龙源塔城老风口风电场一期49.5兆瓦风电项目,风电,2012/4/18,2012,49.5,112,39,并网,山西省,巴彦淖尔市,乌拉特中旗,海流图镇
龙源山西神池继阳山15万千瓦风力发电项目,风电,2013/6/17,2013,150,121.1667,32,并网,江苏省,巴彦淖尔市,乌拉特后旗,潮格温都尔镇
龙源山西静乐康家会15万千瓦风力发电项目,风电,2015/2/10,2015,150,111.9451849,38.36533871,并网,山西省,巴彦淖尔市,乌拉特后旗,潮格温都尔镇
乌拉特中旗20MWp光伏并网发电特许权项目,光伏,,,20,108.5076773,41.58744548,核准,内蒙古自治区,巴彦淖尔市,乌拉特中旗,海流图镇
龙源如东试验风电场扩建项目,风电,2014/9/30,2014,48.8,118.0488,32.0928,并网,安徽省,巴彦淖尔市,乌拉特前旗,额尔登布拉格苏木
龙源全椒龙王尖风电场项目,风电,2015/2/28,2015,49.5,118.29,32.557,并网,安徽省,巴彦淖尔市,乌拉特前旗,额尔登布拉格苏木
乌拉特前旗协合20MWp光伏发电工程,光伏,,,20,108.9833333,40.86666667,核准,内蒙古自治区,巴彦淖尔市,乌拉特前旗,额尔登布拉格苏木
龙源全椒大山风电场项目,风电,2015/2/28,2015,48.3,118.03,32.08,并网,安徽省,巴彦淖尔市,乌拉特后旗,呼和温都尔镇
龙源宁夏同心石崾沟风电项目,风电,2015/4/25,2015,49.5,106.1667,37.0367,并网,宁夏回族自治区,呼和浩特市,武川县,哈乐镇
龙源宁夏同心花石山风电项目,风电,2015/4/25,2015,49.5,91.9167,31.4167,并网,西藏自治区,巴彦淖尔市,乌拉特后旗,潮格温都尔镇
乌拉特后旗建技中研风力发电有限责任公司巴彦淖尔市乌拉特后旗获各琦风电场二期49.5MW风电项目,风电,,,49.5,106.4683,41.3675,核准,内蒙古自治区,巴彦淖尔市,乌拉特后旗,获各琦苏木
龙源宁夏同心红山梁风电项目,风电,2015/12/8,2015,49.5,117.4333,49.5667,并网,内蒙古自治区,毕节市,威宁彝族回族苗族自治县,炉山镇
龙源那曲高海拔试验风电场,风电,2013/11/3,2013,49.5,92.09495494,31.46913308,并网,西藏自治区,毕节市,赫章县,松林坡白族彝族苗族乡
龙源满洲里高尔真风电场,风电,2012/5/2,2012,49.5,117.35795,49.62794,并网,内蒙古自治区,毕节市,七星关区,海子街镇
龙源满都拉诺尔风电场49.5MW项目,风电,2011/11/24,2011,49.5,109.9333,41.5833,并网,内蒙古自治区,毕节市,七星关区,海子街镇
龙源连云港东海李埝风电场二期项目,风电,2015/10/14,2015,50.4,122.45,44.0333,并网,内蒙古自治区,毕节市,七星关区,八寨镇
龙源老黑山风电场,风电,2015/5/21,2015,49.5,104.1762243,27.07218121,并网,贵州省,毕节市,七星关区,海子街镇
乌海鑫盛太阳能科技有限公司光伏发电项目,光伏,,,10,106.8548738,39.42407553,规划,内蒙古自治区,乌海市,海南区,拉僧庙镇
乌海协鑫光伏电力有限公司乌海市采煤沉陷区国家先进技术光伏发电示范基地50MWp光伏发电项目,光伏,,,50,106.8218256,39.68908329,规划,内蒙古自治区,乌海市,海勃湾区,凤凰岭街道
乌海市英能新能源科技有限公司100兆瓦光伏发电项目,光伏,,,100,106.838738,39.41407553,规划,内蒙古自治区,乌海市,海南区,拉僧庙镇
龙源科左后旗西海拉四台风电场4.95万千瓦风电项目,风电,2011/5/3,2011,49.5,123.2,42.55,并网,辽宁省,乌海市,海南区,巴音陶亥镇
龙源科左后旗满斗白音塔拉风电场4.95万千瓦风电项目,风电,2011/5/3,2011,49.5,121.3533,43.8933,并网,内蒙古自治区,乌海市,海南区,巴音陶亥镇
龙源康平西关风力发电,风电,2012/6/17,2012,49.5,123.25,42.6,并网,辽宁省,乌海市,海南区,巴音陶亥镇
龙源康平沙金台风力场项目,风电,2012/9/15,2012,49.5,123.25,42.49,并网,辽宁省,乌海市,海勃湾区,滨河街道
龙源康平方家风力发电,风电,2011/10/19,2011,49.5,123.1655,42.7567,并网,辽宁省,乌海市,海勃湾区,新华西街道
乌海市风光互补项目,光伏,,,20,106.868738,39.49407553,核准,内蒙古自治区,乌海市,海南区,西卓子山街道
乌海市发展和改革委员会关于乌海市正大光电能源有限公司50MW光伏电站综合开发项目一期工程备案的通知,光伏,,,50,106.6,39.25,核准,宁夏回族自治区,石嘴山市,惠农区,惠农区国有山区
乌海市发展和改革委员会关于乌海市正大光电能源有限公司50MW光伏电站综合开发项目二期工程备案的通知,光伏,,,50,106.6,39.25,核准,宁夏回族自治区,石嘴山市,惠农区,惠农区国有山区
乌海市鼎晶光伏科技有限公司10兆瓦建筑一体化光伏发电项目,光伏,,,10,106.8518256,39.69083292,核准,内蒙古自治区,乌海市,海勃湾区,海北街道
乌海市采煤沉陷区国家先进技术光伏发电示范基地100MW项目,光伏,,,100,106.8418256,39.68908329,规划,内蒙古自治区,乌海市,海勃湾区,海北街道
乌海市采煤沉陷区国家先进技术发电示范基地阿特斯100MW光伏发电项目,光伏,,,100,106.9833333,39.98333333,核准,内蒙古自治区,鄂尔多斯市,鄂托克旗,蒙西镇
乌海宁升电力50MW光伏电站项目,光伏,,,50,106.8318256,39.64908329,规划,内蒙古自治区,乌海市,海勃湾区,卡布其街道
龙源康平东升风力发电,风电,2010/8/15,2010,49.5,96.85,41.7333,并网,甘肃省,鹤岗市,绥滨县,连生乡
龙源康平敖力营子风力发电,风电,2010/7/15,2010,49.5,96.15,40.6,并网,甘肃省,黔南布依族苗族自治州,瓮安县,平定营镇
卧羊场二期风电项目,风电,,,49.5,119.0167,42.9167,核准,内蒙古自治区,赤峰市,翁牛特旗,乌丹镇
龙源酒泉肃北马鬃山公婆泉试验风电场49.5MW发电工程,风电,2012/1/18,2012,49.5,95.00248833,39.6373141,并网,甘肃省,中卫市,中宁县,大战场镇
卧龙电气红寺堡风电项目,风电,,,150,106.0235576,37.497,核准,宁夏回族自治区,中卫市,中宁县,鸣沙镇
龙源酒泉瓜州自主化示范风电场300MW发电工程,风电,2010/5/10,2010,300,96.07056155,40.64840712,并网,甘肃省,黔南布依族苗族自治州,瓮安县,银盏镇
翁源周陂风电场项目,风电,,,50,114.1871201,24.48640637,核准,广东省,韶关市,翁源县,坝仔镇
龙源酒泉瓜州北大桥第三风电场201MW发电工程,风电,2010/6/10,2010,201,96.02556944,40.70033866,并网,甘肃省,赤峰市,翁牛特旗,乌丹镇
龙源江西钩刀咀风电场项目,风电,2019/9/22,2019,48.4,115.9155052,26.57216953,并网,江西省,赤峰市,翁牛特旗,亿合公镇
翁牛特旗羊羔山10MW光伏发电项目,光伏,,,10,119.3166667,42.88333333,核准,内蒙古自治区,赤峰市,翁牛特旗,乌丹镇
龙源汇泰滨州北海98.7MW风电项目,风电,2015/11/19,2015,98.7,117.9550556,37.30102287,并网,山东省,赤峰市,翁牛特旗,乌丹镇
龙源和林示范风电场4.95万千瓦风电项目,风电,2011/10/22,2011,49.5,118.018,31.6795,并网,安徽省,赤峰市,松山区,安庆镇
龙源含山县昭关风电场项目,风电,2015/10/11,2015,48.3,118.018,31.6795,并网,安徽省,赤峰市,翁牛特旗,乌丹镇
翁牛特旗马架子1.5兆瓦分散式风电项目,风电,,,1.5,119.964,42.6667,核准,内蒙古自治区,赤峰市,敖汉旗,国营种羊场
龙源含山县梅山风电场项目,风电,2015/11/18,2015,48.3,118.108,31.4,并网,安徽省,赤峰市,克什克腾旗,芝瑞镇
翁牛特旗红山3.7兆瓦分散式风电项目,风电,,,3.7,118.1567,42.7343,核准,内蒙古自治区,赤峰市,翁牛特旗,亿合公镇
龙源哈巴河萨尔塔木风电场一期49.5兆瓦风电项目,风电,2013/10/9,2013,49.5,86.4235,48.045,并网,新疆维吾尔自治区,赤峰市,翁牛特旗,格日僧苏木
翁牛特旗高家梁风电场4.95万千瓦风电项目,风电,,,49.5,118.4333333,42.45,核准,内蒙古自治区,赤峰市,松山区,初头朗镇
闻喜县神柏乡20MW分散式风电项目,风电,,,20,111.209192,29.747984,核准,湖南省,常德市,石门县,三圣乡
闻喜县后宫乡20MW分散式风电项目,风电,,,20,111.53,35.378,核准,山西省,运城市,闻喜县,后宫乡
龙源哈巴河萨尔塔木风电场二期49.5兆瓦风电项目,风电,2014/9/17,2014,49.5,86.49815427,48.035,并网,新疆维吾尔自治区,运城市,闻喜县,裴社乡
闻喜县宏伟风力发电有限公司闻喜县49MW风电项目,风电,,,49,111.4666667,35.28333333,核准,山西省,运城市,闻喜县,石门乡
闻喜县河底二期风电场,风电,,,48,111.56,35.32,核准,山西省,运城市,闻喜县,石门乡
文王山分散式风电项目,风电,,,28,113.25893,36.36418,核准,山西省,长治市,潞城区,潞华街道
龙源格尔木新能源开发有限公司锡铁山50兆瓦风电项目,风电,2019/12/25,2019,50,95.67562873,38.03163873,并网,青海省,文山壮族苗族自治州,丘北县,双龙营镇
文山市60MW农光互补并网光伏发电项目,光伏,,,60,104.2833333,23.23333333,核准,云南省,文山壮族苗族自治州,文山市,古木镇
文景君临正蓝旗一期50MWp干涸盐碱湖生态治理光伏电站示范项目,光伏,,,21.422,115.9166667,42.46666667,核准,内蒙古自治区,锡林郭勒盟,正蓝旗,桑根达来镇
龙源法库叶茂台风力发电,风电,2011/11/28,2011,49.5,123.408,42.548,并网,辽宁省,威海市,文登区,环山街道
龙源法库卧牛石风力发电,风电,2011/11/30,2011,49.5,123.467,42.534,并网,辽宁省,,临高县,波莲镇
龙源法库马鞍山风力发电,风电,2010/10/18,2010,49.5,120.1667,50.2167,并网,内蒙古自治区,六盘水市,盘州市,胜境街道
温州乐泰150兆瓦农光互补光伏发电项目,光伏,,,150,120.8833333,27.88333333,建设,浙江省,温州市,龙湾区,永兴街道
龙源法库马鞍山北风力发电,风电,2011/10/18,2011,49.5,123.408,42.587,并网,辽宁省,酒泉市,玉门市,玉门东镇
龙源额尔古纳葫芦头49.5MW风电项目,风电,2012/5/12,2012,49.5,120.17962,50.24315,并网,内蒙古自治区,,,
温州弘泰发电有限公司8MWp农林光互补光伏发电项目,光伏,,,8,119.723537,27.562171,核准,浙江省,温州市,泰顺县,罗阳镇
龙源杜家沟风电场,风电,2019/6/11,2019,49.5,107.34,37.31333333,并网,陕西省,阿克苏地区,温宿县,兵团五团
龙源定远县能仁寺风电场项目,风电,2014/12/31,2014,48.3,117.648,32.569,并网,安徽省,博尔塔拉蒙古自治州,温泉县,安格里格镇
龙源大丰风力发电有限公司江苏大丰三期（200MW）风电项目,风电,2015/11/30,2015,200,88.1667,43.4333,并网,新疆维吾尔自治区,台州市,温岭市,太平街道
龙源达茂旗满都拉风电场49.5MW风电项目,风电,2011/7/13,2011,49.5,117.9667,32.7667,并网,安徽省,张家口市,蔚县,草沟堡乡
龙源达茂巴音4号风电场201兆瓦发电项目,风电,2015/11/16,2015,201,118.1167,32.8833,并网,安徽省,张家口市,蔚县,草沟堡乡
蔚县秀水盆49.5MW项目,风电,,,49.5,114.6667,39.59,核准,河北省,保定市,涞源县,留家庄乡
龙源达坂城风电场一期49.5兆瓦风电项目,风电,2012/7/18,2012,49.5,88.38,43.353525,并网,新疆维吾尔自治区,张家口市,蔚县,柏树乡
龙源达坂城风电场四场二期49.5兆瓦风电项目,风电,2015/8/27,2015,49.5,88.12,42.0667,并网,新疆维吾尔自治区,张家口市,蔚县,蔚州镇
龙源达坂城风电场三场五期49.5兆瓦风电项目,风电,2014/6/19,2014,49.5,88.12,42.1334,并网,新疆维吾尔自治区,张家口市,蔚县,蔚州镇
龙源滁州明光鲁山风电场项目,风电,2014/1/1,2014,49.5,117.949,32.756,并网,安徽省,张家口市,蔚县,草沟堡乡
龙源滁州定远大金山风电项目,风电,2013/4/30,2013,49.5,117.678,32.599,并网,安徽省,张家口市,蔚县,草沟堡乡
龙源朝阳双塔梨树沟风力发电项目,风电,2012/12/31,2012,49.5,120.56139,41.747078,并网,辽宁省,张家口市,蔚县,蔚州镇
龙源布尔津博孜墩风电场49.5兆瓦风电项目,风电,2014/9/10,2014,49.5,118.1167,37.7,并网,山东省,张家口市,蔚县,蔚州镇
龙源滨州沾化套儿河风电场,风电,2011/4/28,2011,49.5,118.05,37.7,并网,山东省,张家口市,蔚县,蔚州镇
龙源滨州风力发电有限公司沾化五机部49.5MW风电项目,风电,2013/12/31,2013,49.5,118.12,37.76,并网,山东省,张家口市,蔚县,蔚州镇
龙源北票桃花山（49.5MW）风电项目,风电,2013/9/5,2013,49.5,120.8489,42.0554,并网,辽宁省,张家口市,蔚县,草沟堡乡
龙源保康黄连山风电场项目,风电,2017/5/26,2017,48,111.2210403,31.79498719,并网,湖北省,张家口市,蔚县,蔚州镇
龙源巴里坤三塘湖风电场一期49.5兆瓦风电项目,风电,2013/2/26,2013,49.5,93.5333,44.2667,并网,新疆维吾尔自治区,张家口市,蔚县,柏树乡
龙源巴里坤三塘湖风电场四期49.5兆瓦风电项目,风电,2014/6/19,2014,49.5,93.5333,44.2667,并网,新疆维吾尔自治区,张家口市,蔚县,柏树乡
龙源巴里坤三塘湖风电场三期49.5兆瓦风电项目,风电,2014/6/18,2014,49.5,93.5333,44.2667,并网,新疆维吾尔自治区,张家口市,蔚县,涌泉庄乡
龙源巴里坤三塘湖风电场二期49.5兆瓦风电项目,风电,2013/4/18,2013,49.5,82.0667,44.9,并网,新疆维吾尔自治区,张家口市,蔚县,常宁乡
渭南中鼎能源发展有限公司合阳50MW风电项目,风电,,,50,110.2084388,35.41970863,规划,陕西省,渭南市,韩城市,芝阳镇
龙源阿拉山口风电场四期（江巴斯）49.5兆瓦风电项目,风电,2015/12/16,2015,49.5,82.495,45.1283,并网,新疆维吾尔自治区,渭南市,澄城县,庄头镇
龙源阿拉山口风电场三期49.5兆瓦风电项目,风电,2014/1/19,2014,49.5,121.4685,45.0432,并网,内蒙古自治区,渭南市,合阳县,金峪镇
龙源（科右中旗）风力发电有限公司兴安盟科右中旗楚古拉风电场49.5MW项目,风电,2013/8/31,2013,49.5,96.3667,40.7167,并网,甘肃省,渭南市,澄城县,交道镇
龙源(酒泉)风力发电瓜州安北第四风电场A区项目201.0MW发电工程,风电,2014/11/28,2014,201,96.05264044,40.61590289,并网,甘肃省,巴音郭楞蒙古自治州,尉犁县,塔里木乡
伟恒泥洋山风电场,风电,,,50,115.1,28.7677,建设,江西省,宜春市,奉新县,罗市镇
龙源（包头）风力发电有限责任公司包头巴音风电场20万千瓦风电特许权项目,风电,2008/8/19,2008,201,109.8666667,41.73333333,并网,内蒙古自治区,潍坊市,高密市,姜庄镇
龙源(巴彦淖尔)风力发电有限责任公司乌拉特中旗川井五期49.5MW项目,风电,2009/10/10,2009,49.5,108.3333,41.9833,并网,内蒙古自治区,潍坊市,安丘市,新安街道
龙源(巴彦淖尔)风力发电有限责任公司乌拉特中旗川井四期49.3MW项目,风电,2008/11/5,2008,49.3,108.2667,41.95,并网,内蒙古自治区,潍坊市,坊子区,坊安街道
龙源(巴彦淖尔)风力发电有限责任公司乌拉特中旗川井风电场三期49.5MW项目,风电,2007/12/31,2007,49.5,108.2833,41.9833,并网,内蒙古自治区,潍坊市,昌邑市,卜庄镇
龙源(巴彦淖尔)风力发电有限责任公司乌拉特中旗川井二期49.3MW项目,风电,2007/11/11,2007,49.3,116.958,24.7525,并网,福建省,潍坊市,寒亭区,大家洼街道
潍北农场20MW光伏发电,光伏,,,15,119.4035268,36.9101437,核准,山东省,潍坊市,昌邑市,奎聚街道
龙胜南山风电场一期工程项目,风电,2015/6/5,2015,49.5,110.919604,24.87955002,并网,广西壮族自治区,承德市,围场满族蒙古族自治县,围场镇
龙胜南山风电场二期工程,风电,,,49.5,110.9069906,24.94293127,并网,广西壮族自治区,承德市,围场满族蒙古族自治县,燕格柏乡
龙南雷公山风电场,风电,2018/1/20,2018,70,114.813454,24.9029153,并网,江西省,承德市,围场满族蒙古族自治县,御道口镇
龙马风电场,风电,2017/12/30,2017,42,102.5416571,25.26819832,并网,云南省,承德市,围场满族蒙古族自治县,宝元栈乡
龙里县苦蒿坪风电场,风电,2014/12/16,2014,49.5,107.0573401,26.54186538,并网,贵州省,承德市,围场满族蒙古族自治县,山湾子乡
龙里上坝分散式接入风电场,风电,2015/3/20,2015,20,107.10524,26.59651262,并网,贵州省,承德市,围场满族蒙古族自治县,宝元栈乡
龙里马郎坡风电场,风电,2014/10/1,2014,48,107.06525,26.59918634,并网,贵州省,承德市,围场满族蒙古族自治县,塞罕坝机械林场
龙里风电场一期（草原）,风电,2013/7/10,2013,48,107.0968984,26.54735416,并网,贵州省,承德市,围场满族蒙古族自治县,大唤起乡
围场县中草药种植结合50兆瓦光伏发电项目,光伏,,,50,117.9216667,42.3124,核准,河北省,承德市,围场满族蒙古族自治县,张家湾乡
围场县中草药种植结合50MW光伏发电项目,光伏,,,50,116.9666667,42.35,核准,河北省,承德市,围场满族蒙古族自治县,国营御道口牧场
龙里风电场二期（坪子）,风电,2013/7/12,2013,48,107.0922041,26.54949387,并网,贵州省,承德市,围场满族蒙古族自治县,姜家店乡
龙里大坪子风电场,风电,2013/7/12,2013,48,107.0331047,26.57017615,并网,贵州省,承德市,围场满族蒙古族自治县,山湾子乡
围场棋新300兆瓦风电场项目,风电,,,300,117.6,42.55,核准,河北省,承德市,围场满族蒙古族自治县,姜家店乡
龙口东宜风电有限公司北马风电场工程,风电,2015/12/31,2015,30,120.5,37.6167,并网,山东省,承德市,围场满族蒙古族自治县,育太和乡
龙江杏山风电场,风电,2014/11/10,2014,49.5,123.4,47.55,并网,黑龙江省,承德市,围场满族蒙古族自治县,张家湾乡
龙江哈拉海乡(49.5MW)风电场项目,风电,2013/4/2,2013,49.5,123.4167,47.35,并网,黑龙江省,承德市,围场满族蒙古族自治县,国营御道口牧场
龙海新厝风电场,风电,2015/10/14,2015,47.5,118.0333,24.3,并网,福建省,承德市,围场满族蒙古族自治县,宝元栈乡
龙海新村风电场,风电,2015/6/29,2015,48,118.0333,24.3,并网,福建省,承德市,围场满族蒙古族自治县,姜家店乡
围场高家山48MW风电场项目,风电,,,48,116.8833333,42.05,核准,内蒙古自治区,锡林郭勒盟,多伦县,滦源镇
