航天唐山南堡风电100MW工程项目,风电,,,100,118.25,39.25,核准,河北省,唐山市,曹妃甸区,滨海镇
宁夏中利腾晖新能源石嘴山惠农100MWp并网光伏发电项目,光伏,2014/12/23,2014,100,96.75,39.18333333,并网,甘肃省,金昌市,金川区,宁远堡镇
杭州帷盛太阳能金川西坡50兆瓦并网光伏发电项目一期25兆瓦项目,光伏,,,25,102.1234023,38.58782002,核准,甘肃省,金昌市,金川区,宁远堡镇
宁夏中利淇晖同心50MW光伏电站项目,光伏,2018/6/30,2018,50,105.9,36.96666667,并网,宁夏回族自治区,杭州市,萧山区,宁围街道
宁夏中利明晖新能源惠农30MW光伏发电项目,光伏,2016/6/29,2016,30,106.6333333,39.16666667,并网,宁夏回族自治区,衢州市,江山市,贺村镇
杭锦旗众跃太阳能发电杭锦旗巴拉贡100MWp(一期20MWp）光伏发电结合抗旱蒙草种植综合项目,光伏,,,20,113.1833333,40.23333333,核准,山西省,大同市,新荣区,西村乡
宁夏中利常晖新能源惠农泽湖20MW渔光互补光伏发电项目,光伏,2016/3/31,2016,20,106.7236667,39.2,并网,宁夏回族自治区,赤峰市,克什克腾旗,芝瑞镇
宁夏正泰太阳山光伏并网电站一期10MWp工程项目,光伏,2012/5/8,2012,10,106.252323,37.91666667,并网,宁夏回族自治区,鄂尔多斯市,达拉特旗,中和西镇
宁夏正泰石嘴山光伏并网电站二期10MWP工程项目,光伏,2011/12/30,2011,10,106.7357272,39.2539163,并网,宁夏回族自治区,巴彦淖尔市,乌拉特后旗,获各琦苏木
宁夏振阳新能源沙坡头100MW光伏发电项目,光伏,2013/12/31,2013,100,105.2833333,37.4999433,并网,宁夏回族自治区,巴彦淖尔市,乌拉特后旗,获各琦苏木
宁夏振启光伏发电金凤红墩子30MW光伏发电项目,光伏,2013/8/28,2013,30,106.5166667,38.4,并网,宁夏回族自治区,石家庄市,灵寿县,青同镇
汉源县清溪风电场项目,风电,,,47.5,102.4001517,29.21074747,核准,四川省,雅安市,石棉县,回隆镇
汉薛镇分散式风电项目,风电,,,10,110.84781,35.42534,核准,山西省,运城市,万荣县,解店镇
汉旭太阳能怀远县魏庄镇20MW光伏电站项目,光伏,,,20,117.1998,33.0906,核准,安徽省,蚌埠市,怀远县,魏庄镇
汉旭太阳能怀远县魏庄镇20MW光伏电站项目,光伏,,,20,117.211506,32.976004,核准,安徽省,蚌埠市,怀远县,榴城镇
宁夏长和阳光惠农光伏电站项目,光伏,2017/6/26,2017,10,106.7833333,39.25,并网,宁夏回族自治区,德州市,平原县,王庙镇
宁夏远途光伏农业发电项目,光伏,2015/6/6,2015,50,105.0666667,37.53333333,并网,宁夏回族自治区,吴忠市,利通区,东塔寺乡
宁夏银阳50MWp光伏农业发电项目,光伏,2015/6/6,2015,50,105.0666667,37.53333333,并网,宁夏回族自治区,徐州市,邳州市,燕子埠镇
宁夏银星能源吴忠孙家滩20MWp光伏并网发电项目,光伏,,,20,106.2086067,37.98451939,并网,宁夏回族自治区,滁州市,明光市,古沛镇
宁夏意科太阳能发电有限公司高沙窝光伏发电一期10MWp工程项目,光伏,,,10,107.4034321,37.72312,并网,宁夏回族自治区,徐州市,新沂市,高流镇
汉能库尔勒光伏并网发电项目,光伏,,,20,86.17110284,41.72641612,核准,新疆维吾尔自治区,巴音郭楞蒙古自治州,库尔勒市,铁克其乡
宁夏意科太阳能发电有限公司高沙窝光伏发电二期10MWp项目,光伏,,,10,107.4401702,37.75658299,并网,宁夏回族自治区,海南藏族自治州,共和县,恰卜恰镇
宁夏盐池兆亿新能源15MWp光伏电站项目,光伏,2016/6/30,2016,15,106.8833333,37.58333333,并网,宁夏回族自治区,哈密市,伊州区,西山乡
汉能丹江口20MW光伏发电项目,光伏,,,20,111.5488026,32.55482561,规划,湖北省,十堰市,丹江口市,大坝街道
宁夏旭宁新能源科技兴庆30MW光伏发电项目,光伏,2014/12/31,2014,30,105.35,37.6,并网,宁夏回族自治区,阿克苏地区,新和县,尤鲁都斯巴格镇
汉风泗县草庙风电场项目,风电,,,50,117.951,33.492,核准,安徽省,宿州市,泗县,泗县开发区
宁夏鑫垦350MWp光伏电站项目一期30MWp项目,光伏,2018/6/29,2018,30,106.6,39.1,并网,宁夏回族自治区,孝感市,汉川市,新河镇
韩城市芝阳镇分散式风电项目,风电,,,20,110.4628333,35.66333333,核准,陕西省,渭南市,韩城市,西庄镇
韩城市西庄镇分散式风电项目,风电,,,20,110.4591667,35.6857,核准,陕西省,渭南市,韩城市,桑树坪镇
韩城市常丰和40兆瓦分散式风电项目,风电,,,40,110.8374667,35.81666667,核准,山西省,临汾市,乡宁县,西交口乡
韩城润阳新能源二期50兆瓦风电项目,风电,,,50,110.6415405,35.67122227,核准,山西省,运城市,河津市,清涧街道
韩城润阳新能源50MW风电项目,风电,,,80,110.6299964,35.6852349,核准,山西省,运城市,河津市,清涧街道
含山县运漕镇20MW渔光互补光伏发电项目,光伏,,,20,118.4833333,31.71,规划,安徽省,马鞍山市,雨山区,佳山乡
含山县大圩湾一期10MW渔光互补光伏发电项目,光伏,,,10,118.473,31.7,规划,安徽省,马鞍山市,雨山区,佳山乡
邯郸市三信农业园区,光伏,,,140,113.8936667,36.79133333,核准,河北省,邯郸市,武安市,管陶乡
邯郸肥乡区捷弘150兆瓦风电场项目,风电,,,150,114.80002,36.54811,核准,河北省,邯郸市,肥乡区,肥乡镇
邯郸肥乡区捷弘150兆瓦风电场（一期100MW）,风电,,,100,114.8333333,36.56666667,核准,河北省,邯郸市,肥乡区,肥乡镇
海装如东H3#300MW海上风电场工程,风电,,,300,121.51667,32.716667,建设,,,,
宁夏吴忠太科光伏电力红寺堡大河乡10MW光伏发电项目,光伏,2013/12/30,2013,10,106.298,37.9787667,并网,宁夏回族自治区,吴忠市,同心县,田老庄乡
海原县振发光伏电力海原50MW生态农业光伏发电项目,光伏,,,50,104.2833333,35.23333333,核准,甘肃省,定西市,渭源县,北寨镇
宁夏天得旭日光伏发电公司石嘴山10MWp光伏电站发电项目,光伏,2015/4/11,2015,10,106.7117727,39.28739163,并网,宁夏回族自治区,烟台市,海阳市,凤城街道
宁夏索宝中卫二期光伏电站项目,光伏,2015/12/31,2015,20,105.1932045,37.4999433,并网,宁夏回族自治区,烟台市,海阳市,凤城街道
宁夏索宝中卫20MWp光伏电站发电项目,光伏,2014/9/24,2014,20,105.0333333,37.56666667,并网,宁夏回族自治区,沧州市,海兴县,海兴县农场
宁夏盛阳中卫30MWp光伏电站项目,光伏,2013/5/23,2013,30,105.1746667,37.51866667,并网,宁夏回族自治区,海西蒙古族藏族自治州,德令哈市,蓄集乡
宁夏盛唐太阳能科技有限公司灵武市一期50MWp光伏电站发电项目,光伏,2016/10/1,2016,50,106.4166667,37.73333333,并网,宁夏回族自治区,海西蒙古族藏族自治州,格尔木市,大格勒乡
宁夏盛景太阳能科技永宁30MW农业科技大棚光伏发电项目,光伏,2015/8/12,2015,30,105.8166667,38.63333333,并网,内蒙古自治区,海西蒙古族藏族自治州,德令哈市,柯鲁柯镇
海西华汇大柴旦50兆瓦风电建设项目,风电,,,50,95.35,37.25,核准,青海省,海西蒙古族藏族自治州,海西蒙古族藏族自治州直辖,锡铁山镇
海天达六师北塔山托浪岗49MW分散式风电项目,风电,,,49,116.33143,39.887631,规划,北京市,北京市,西城区,广安门外街道
海天达六师北塔山二牧场48MW分散式风电项目,风电,,,48,116.33143,39.887631,建设,北京市,北京市,西城区,广安门外街道
宁夏庆阳新能源100MW光伏发电项目,光伏,2013/12/30,2013,100,105.1746667,37.51866667,并网,宁夏回族自治区,塔城地区,和布克赛尔蒙古自治县,和布克赛尔镇
宁夏青铜峡并网光伏电站中广核一期10MWp工程项目,光伏,2011/8/25,2011,10,106.0987445,38.0323211,并网,宁夏回族自治区,巴彦淖尔市,乌拉特前旗,乌拉山镇
海润云南省玉溪市易门县十街50MWp并网光伏电站,光伏,,,50,102.15,24.46666667,核准,云南省,玉溪市,峨山彝族自治县,大龙潭乡
宁夏平罗光伏并网电站国电二期20MWp工程项目,光伏,,,20,106.5255825,38.913537,并网,宁夏回族自治区,乌兰察布市,兴和县,城关镇
海润光伏科技股份有限公司凉州区二期100兆瓦并网光伏发电项目,光伏,,,100,102.791523,38.15022258,核准,甘肃省,武威市,凉州区,九墩滩指挥部
海润光伏科技股份睢宁县姚集镇太平山19MW地面光伏电站项目,光伏,,,19,116.25,34.1766667,核准,河南省,商丘市,夏邑县,北岭镇
宁夏欧贝黎大武口10MWp光伏电站项目,光伏,2015/2/5,2015,10,106.4166667,38.95,并网,宁夏回族自治区,吐鲁番市,高昌区,恰特喀勒乡
宁夏宁东欣润300MWp并网光伏发电项目,光伏,2016/6/27,2016,300,106.7733333,38.03166667,并网,宁夏回族自治区,博尔塔拉蒙古自治州,精河县,大河沿子镇
海宁市科技园区15MW微电网系统项目,光伏,,,15,120.7,30.53333333,核准,浙江省,嘉兴市,海宁市,硖石街道
宁夏宁东神舟光伏电力一期100MW光伏发电项目,光伏,2014/11/1,2014,100,106.7333333,38.15321111,并网,宁夏回族自治区,嘉兴市,海宁市,黄湾镇
宁夏宁东神舟光伏电力灵武二期50MW光伏发电项目,光伏,2015/9/10,2015,50,106.7566667,38.15,并网,宁夏回族自治区,海南藏族自治州,共和县,黑马河镇
宁夏绿昊光伏发电大武口20MW渔光互补光伏发电项目,光伏,2016/3/28,2016,20,106.7833333,38.76666667,并网,内蒙古自治区,海南藏族自治州,共和县,切吉乡
宁夏利能中宁光伏产业园30MWp光伏电站发电项目,光伏,2015/9/21,2015,30,105.7666667,37.61666667,并网,宁夏回族自治区,海南藏族自治州,共和县,塘格木镇
宁夏晶科光伏发电有限公司一期50MW并网光伏电站项目,光伏,2016/1/16,2016,50,106.55,37.73333333,并网,宁夏回族自治区,海南藏族自治州,共和县,恰卜恰镇
海南州鑫源新能源有限公司共和5万千瓦风电项目,风电,,,50,100.6784233,36.36090664,核准,青海省,海南藏族自治州,共和县,恰卜恰镇
宁夏京能太阳山光伏并网电站一期10MWp工程,光伏,2011/12/31,2011,10,106.548,37.4971864,并网,宁夏回族自治区,海南藏族自治州,共和县,石乃亥镇
海南州蔚蓝新能源有限公司共和5万千瓦风电项目,风电,,,50,100.6491123,36.37334778,核准,青海省,海南藏族自治州,共和县,恰卜恰镇
宁夏京能太阳山180MWp光伏发电项目,光伏,2019/12/25,2019,180,115.988428,40.458179,并网,北京市,海南藏族自治州,共和县,恰卜恰镇
宁夏京能宁东（灵武新立）二期光伏电站项目,光伏,2016/1/10,2016,20,106.5446667,37.675,并网,宁夏回族自治区,海南藏族自治州,共和县,黑马河镇
宁夏京能海原（关桥）10MWp光伏发电项目,光伏,2016/5/11,2016,10,105.15,36.1,并网,甘肃省,海南藏族自治州,共和县,黑马河镇
海南州青水光伏发电有限公司Ⅱ#8-3地块50兆瓦光伏项目,光伏,,,50,99.6,36.16666667,核准,青海省,海南藏族自治州,共和县,切吉乡
宁夏金阳新能源有限公司30MWp太阳能光伏发电,光伏,2011/12/23,2011,30,105.1932045,37.4999433,并网,宁夏回族自治区,海南藏族自治州,共和县,黑马河镇
宁夏金信光伏电力沙坡头50MW光伏发电项目,光伏,2015/7/15,2015,50,105.0666667,37.53333333,并网,宁夏回族自治区,海南藏族自治州,共和县,铁盖乡
宁夏金礼光伏电力沙坡头50MW光伏发电项目,光伏,2015/7/30,2015,50,105.0333333,37.55,并网,宁夏回族自治区,海南藏族自治州,共和县,恰卜恰镇
宁夏揭阳中源电力惠农一期10MW农光互补光伏发电项目,光伏,2014/12/20,2014,10,106.7166667,39.33333333,并网,宁夏回族自治区,海南藏族自治州,共和县,恰卜恰镇
海南州科士达科技有限公司共和10MWp并网光伏发电项目,光伏,,,10,99.7434,36.70303812,规划,青海省,海南藏族自治州,共和县,黑马河镇
宁夏揭阳中源电力惠农二期10MW光伏发电项目,光伏,2016/1/20,2016,10,106.7166667,39.33333333,并网,宁夏回族自治区,海西蒙古族藏族自治州,天峻县,新源镇
海南州聚亚新能源有限公司共和（二期）25兆瓦并网光伏发电项目,光伏,,,25,99.816529,36.34343591,核准,青海省,海南藏族自治州,共和县,切吉乡
宁夏江山新能源15MWp光伏电站项目,光伏,2016/6/30,2016,15,106.8833333,37.55,并网,宁夏回族自治区,海南藏族自治州,共和县,恰卜恰镇
宁夏嘉泽红寺堡大河乡光伏电站二期项目,光伏,2013/12/18,2013,30,106,37.3,并网,宁夏回族自治区,海南藏族自治州,共和县,沙珠玉乡
宁夏嘉泽红寺堡大河乡20MWp光伏并网发电项目,光伏,2013/5/15,2013,20,106.0575545,37.42565878,并网,宁夏回族自治区,张掖市,民乐县,丰乐镇
宁夏汇合中卫常乐光伏电站项目,光伏,2015/12/14,2015,30,105.1932045,37.4999433,并网,宁夏回族自治区,海南藏族自治州,共和县,沙珠玉乡
宁夏红寺堡光伏发电一厂50MWp工程,光伏,,,50,106.0575545,37.42565878,并网,宁夏回族自治区,海南藏族自治州,共和县,恰卜恰镇
宁夏恒阳新能源沙坡头30MW光伏发电项目,光伏,2014/8/9,2014,30,105,37,并网,甘肃省,海南藏族自治州,共和县,切吉乡
宁夏贺兰京能新能源30MW光伏发电项目,光伏,2015/12/26,2015,30,106.3,38.66666667,并网,宁夏回族自治区,海南藏族自治州,共和县,铁盖乡
宁夏汉南光伏电力沙坡头20MW光伏发电项目,光伏,2015/6/17,2015,20,105.0333333,37.51666667,并网,宁夏回族自治区,海南藏族自治州,共和县,石乃亥镇
宁夏海鑫泰光伏农业发展太阳山10MW光伏发电项目,光伏,2015/12/23,2015,10,106.2166667,38.48333333,并网,宁夏回族自治区,海南藏族自治州,共和县,恰卜恰镇
宁夏国信光伏能源有限公司盐池光伏发电与畜牧加工一体化项目,光伏,2015/12/24,2015,100,107.1,37.9,并网,宁夏回族自治区,海南藏族自治州,共和县,恰卜恰镇
宁夏国电大武口光伏并网电站一期10MWp工程项目,光伏,,,10,106.363341,39.01905481,并网,宁夏回族自治区,海南藏族自治州,共和县,石乃亥镇
宁夏光源电力太阳山一期20MW光伏发电项目,光伏,2016/1/14,2016,20,105.7166667,37.43862222,并网,宁夏回族自治区,海南藏族自治州,共和县,黑马河镇
宁夏发电集团中卫寺口子20MWp光伏并网发电项目,光伏,,,20,105.1932045,37.4999433,并网,宁夏回族自治区,海南藏族自治州,共和县,恰卜恰镇
海南州飞翔新能源有限责任公司共和10万千瓦风电项目,风电,,,100,100.6780599,36.35964214,核准,青海省,海南藏族自治州,共和县,恰卜恰镇
宁夏发电集团头营光伏并网电站10MWp工程,光伏,,,10,106.283754,36.00346296,并网,宁夏回族自治区,黄南藏族自治州,尖扎县,坎布拉镇
宁夏发电集团太阳山光伏并网电站三期30MWp工程,光伏,2013/9/27,2013,30,106.25232,37.94366667,并网,宁夏回族自治区,海南藏族自治州,共和县,恰卜恰镇
宁夏电投太阳山光伏发电20MW渔光互补光伏发电项目,光伏,2013/12/25,2013,20,106.5333333,37.46666667,并网,宁夏回族自治区,海南藏族自治州,共和县,恰卜恰镇
宁夏电力投资集团公司太阳山10MWp光伏并网电站项目,光伏,,,10,106.5444315,37.42186401,并网,宁夏回族自治区,海南藏族自治州,共和县,石乃亥镇
海南州奔亚科技发展有限公司共和三期10兆瓦并网光伏发电项目,光伏,,,10,99.73337953,36.74430381,核准,青海省,海南藏族自治州,共和县,黑马河镇
宁夏大唐新能源青铜峡有限公司光伏并网电站10MWp工程,光伏,2011/9/17,2011,10,106.0547445,38.0768211,并网,宁夏回族自治区,海西蒙古族藏族自治州,都兰县,热水乡
宁夏大唐国际青铜峡光伏电站二期20MWp工程项目,光伏,,,20,106.0454745,38.0677211,并网,宁夏回族自治区,海南藏族自治州,共和县,石乃亥镇
宁夏大唐国际红寺堡20MWp光伏并网电站工程,光伏,2013/12/13,2013,20,106.245,37.90666667,并网,宁夏回族自治区,海南藏族自治州,共和县,恰卜恰镇
宁夏大唐昂立（灵武）新能源有限公司40MWp工程项目,光伏,2011/12/28,2011,39,106.3354253,38.10256019,并网,宁夏回族自治区,,乐东黎族自治县,抱由镇
宁夏宝丰新能源发展有限公司250MWp光伏发电项目,光伏,2018/6/27,2018,250,106.5333333,38.36666667,并网,内蒙古自治区,,东方市,板桥镇
宁夏宝丰红墩子矿区光伏发电项目,光伏,2016/6/27,2016,390,106.5333333,38.36666667,并网,内蒙古自治区,,东方市,三家镇
宁夏昂立灵武沙沟20MWp光伏电站项目,光伏,2014/12/21,2014,20,106.3666667,37.81666667,并网,宁夏回族自治区,张掖市,民乐县,洪水镇
宁夏昂立灵武白土岗40MWp光伏并网发电项目,光伏,2013/5/5,2013,40,106.55,37.81666667,并网,宁夏回族自治区,,乐东黎族自治县,抱由镇
海南省东方市大田镇戈枕30MW光伏电站项目,光伏,,,30,108.6944175,19.18169011,核准,海南省,,东方市,八所镇
宁夏阿特斯佳阳平罗高仁19万kW光伏电站,光伏,2019/12/17,2019,190,106.536518,38.919607,并网,宁夏回族自治区,,昌江黎族自治县,石碌镇
宁海蛇潘涂99MW渔光互补光伏发电项目,光伏,2017/5/28,2017,99,117.8372429,29.26666667,并网,江西省,海南藏族自治州,共和县,切吉乡
宁德东侨光伏发电项目,光伏,,,10,119.56,26.714,并网,福建省,,定安县,定城镇
宁波汇能能源鹤浦30MW农光互补发电项目,光伏,2017/12/29,2017,30,117.0319268,29.08333333,并网,江西省,,昌江黎族自治县,叉河镇
泥河20MW渔光互补光伏发电项目,光伏,2016/12/30,2016,20,116.8767,32.893333,并网,安徽省,海西蒙古族藏族自治州,都兰县,热水乡
海南奔亚科技发展有限公司共和10兆瓦并网光伏发电项目,光伏,,,10,100.2,36.25,核准,青海省,海南藏族自治州,共和县,沙珠玉乡
海伦市向荣乡150兆瓦风电项目,风电,,,150,126.936509,47.456904,规划,黑龙江省,绥化市,海伦市,海伦镇
海伦市南兴村分散式风电项目,风电,,,5,126.9733463,47.46208799,核准,黑龙江省,绥化市,海伦市,海伦镇
海伦市解放村分散式风电项目,风电,,,6,126.97338,47.4621,核准,黑龙江省,绥化市,海伦市,海伦镇
海伦市东林乡分散式风电项目,风电,,,11,126.979738,47.46845724,核准,黑龙江省,绥化市,海伦市,海伦镇
尼勒克县中利腾晖光伏发电20MW光伏发电项目,光伏,2015/12/28,2015,20,82.45,43.85,并网,新疆维吾尔自治区,吐鲁番市,鄯善县,连木沁镇
海丰县可塘镇200MW渔光互补、农光互补综合光伏电站项目,光伏,,,200,115.428629,22.912112,核准,广东省,汕尾市,海丰县,陶河镇
内蒙古自治区二连浩特市华电风光互补示范项目,光伏,,,22,112,43.58333333,并网,内蒙古自治区,海南藏族自治州,贵德县,常牧镇
内蒙古准兴新能源投资有限公司一期5万千瓦风光同场光伏发电项目,光伏,2017/6/30,2017,50,111.9833333,41.98333333,并网,内蒙古自治区,海东市,乐都区,碾伯镇
海东市亚硅新能源开发有限公司化隆40兆瓦并网光伏发电项目,光伏,,,40,102.2833333,36.06666667,核准,青海省,海东市,化隆回族自治县,谢家滩乡
内蒙古源海新能源有限责任公司乌拉特后旗20MWP生态光伏发电项目,光伏,2014/12/26,2014,20,106.6666667,40.9,并网,内蒙古自治区,海东市,乐都区,碾伯镇
内蒙古元华农业发展有限公司察右中旗100MWp光伏并网发电项目,光伏,2015/12/31,2015,100,112.5666667,41.26666667,并网,内蒙古自治区,鞍山市,海城市,验军街道
内蒙古银晟新能源有限公司赛罕区光伏农业大棚观光一体化一期30MW光伏电站,光伏,2016/12/12,2016,20,111.95,40.76666667,并网,内蒙古自治区,阜阳市,颍上县,鲁口镇
内蒙古兴晟太阳能电力兴安盟科右前旗50MWp结合林业光伏发电项目,光伏,2014/12/28,2014,50,121.3,46.53333333,并网,内蒙古自治区,盐城市,射阳县,临海镇
内蒙古鑫盛太阳能科技有限公司50MW棚顶光伏发电项目,光伏,2016/3/28,2016,20,111.9666667,40.91666667,并网,内蒙古自治区,,,
哈纳斯盐池风电场(大水坑新泉井)项目,风电,,,49.4,121.022575,30.682241,核准,浙江省,嘉兴市,平湖市,当湖街道
内蒙古欣盛光伏科技霍林郭勒20MW光伏发电项目,光伏,2013/12/19,2013,20,119.65,45.51666667,并网,内蒙古自治区,嘉兴市,平湖市,当湖街道
内蒙古香岛宇能农业土右旗65MW光伏发电项目,光伏,2014/12/12,2014,65,110.6333333,40.51666667,并网,内蒙古自治区,哈密市,伊州区,西河区街道
内蒙古香岛生态农业开发土左旗兵州亥130MWp光伏发电项目,光伏,2014/12/31,2014,130,111.1562378,40.72955226,并网,内蒙古自治区,哈密市,伊州区,新市区街道
哈密宣力光伏科技有限,光伏,,,50,93.25,42.85,核准,新疆维吾尔自治区,哈密市,伊州区,兵团红星二场
内蒙古香岛古路板电站,光伏,2016/5/14,2016,31,111.2333333,40.25,并网,内蒙古自治区,哈密市,伊州区,南湖乡
哈密新粤能有限公司一期5万千瓦风电项目,风电,,,50,91.85,43.31666667,核准,新疆维吾尔自治区,哈密市,伊州区,七角井镇
内蒙古通辽市扎鲁特旗阿日昆都楞风电场50MWp光伏发电项目,光伏,2016/1/4,2016,10,119.8833333,45.35,并网,内蒙古自治区,阿拉善盟,额济纳旗,马鬃山苏木
内蒙古太华农业发展有限公司五原县50MWp光伏新镇示范项目.,光伏,2016/6/30,2016,50,108.261713,41.08836162,并网,内蒙古自治区,哈密市,伊州区,大泉湾乡
哈密天源泰达风力发电有限公司30万千瓦风力发电项目,风电,,,300,117.329,,规划,,,,
内蒙古太华农业发展五原50MW光伏发电项目,光伏,2016/1/22,2016,50,108.2,41.08836162,并网,内蒙古自治区,哈密市,伊州区,七角井镇
内蒙古四子王旗神光能源江岸苏木100MW光伏发电项目,光伏,2015/7/8,2015,100,111.0833333,42.55,并网,内蒙古自治区,哈密市,伊州区,花园乡
内蒙古晟宇太阳能电力五原30MW渔光互补光伏发电项目,光伏,2013/12/30,2013,30,108.2,41.04613333,并网,内蒙古自治区,哈密市,伊州区,天山乡
内蒙古晟明太阳能电力土右旗50MW光伏发电项目,光伏,2015/11/27,2015,50,110.6166667,40.55,并网,内蒙古自治区,哈密市,伊州区,天山乡
哈密融信汇能十三师十三间房风区49.5MW风电项目,风电,,,49.5,93.58502128,42.83259,核准,新疆维吾尔自治区,哈密市,伊州区,陶家宫镇
内蒙古晟达太阳能科技凉城50MW光伏发电项目,光伏,2015/1/16,2015,50,112.4666667,40.51666667,并网,内蒙古自治区,哈密市,伊州区,天山乡
内蒙古神舟光伏电力巴彦淖尔市包尔盖农场20MWp光伏发电项目,光伏,2013/1/1,2013,20,107.0029303,40.3305303,并网,内蒙古自治区,哈密市,伊州区,德外里都如克哈萨克族乡
内蒙古山路农业30MW光伏发电项目,光伏,2015/12/31,2015,30,111.75,40.03333333,并网,内蒙古自治区,哈密市,伊州区,德外里都如克哈萨克族乡
内蒙古三信新能源有限公司集宁50MWp太阳能电站项目,光伏,2013/12/31,2013,50,113.1467191,41.16535543,并网,内蒙古自治区,哈密市,伊州区,陶家宫镇
哈密莱北新能源十三师柳树泉农场十三间房风区风电场一期4.95万千瓦风力发电项目,风电,,,49.5,93.52450213,42.83147118,核准,新疆维吾尔自治区,哈密市,伊州区,东河区街道
哈密昆帆十三师十三间房49.5MW风电项目,风电,,,49.5,93.54502128,42.847118,核准,新疆维吾尔自治区,哈密市,伊州区,新市区街道
内蒙古庆华集团额济纳50MWp光伏发电项目,光伏,2014/12/31,2014,50,100.9166667,41.86666667,并网,内蒙古自治区,哈密市,伊州区,南湖乡
内蒙古清佑新能源科技察右中旗10MW光伏发电项目,光伏,2016/6/30,2016,10,112.3666667,41.43333333,并网,内蒙古自治区,哈密市,伊州区,天山乡
内蒙古乾华农业发展托克托二期100MW光伏发电项目,光伏,2015/12/27,2015,100,111.3666667,40.41666667,并网,内蒙古自治区,哈密市,伊州区,西河区街道
哈密汇聚成30兆瓦并网光伏发电项目,光伏,,,30,93.51666667,42.81666667,核准,新疆维吾尔自治区,哈密市,伊州区,西河区街道
内蒙古乾华农业发展托克托100MW农业科技大棚光伏发电项目,光伏,2014/12/31,2014,100,111.1666667,40.26666667,并网,内蒙古自治区,哈密市,伊州区,沁城乡
内蒙古能源发电公主岭风电有限公司风光同场20MWp光伏发电项目工程（一期10MWp）,光伏,2017/6/30,2017,10,122.2333333,46.25,并网,内蒙古自治区,哈密市,伊州区,大泉湾乡
内蒙古能建恒达新能源达拉特旗一期20MW光伏发电项目,光伏,2016/1/13,2016,20,110.0643533,40.455,并网,内蒙古自治区,哈密市,伊州区,七角井镇
内蒙古明华能源集团有限公司土右旗20MWp屋顶太阳能发电站项目,光伏,2013/12/18,2013,20,110.6333333,40.58333333,并网,内蒙古自治区,哈密市,伊州区,兵团红星二场
内蒙古蒙能巴音杭盖光伏发电有限公司巴彦淖尔市乌拉特中旗20MWp光伏并网发电特许权项目,光伏,2016/9/29,2016,20,108.519512,41.593346,并网,内蒙古自治区,哈密市,伊州区,星星峡镇
内蒙古蒙锦汇农业开发有限公司杭锦旗100MW沙漠光伏并网发电示范项目,光伏,2016/6/4,2016,100,106.9166667,39.36666667,并网,内蒙古自治区,哈密市,伊州区,大泉湾乡
内蒙古蒙发电力开发有限公司乌拉特中期20兆峰瓦光伏发电项目,光伏,2016/6/30,2016,20,108.9833333,41.98333333,并网,内蒙古自治区,吐鲁番市,鄯善县,火车站镇
内蒙古利硕光伏发电有限公司30MWp并网光伏发电项目,光伏,2017/4/28,2017,30,119.3731132,43.97009328,并网,内蒙古自治区,哈密市,伊州区,大泉湾乡
