明阳阳江沙扒300MW科研示范项目,风电,,,300,118.88,21.45,核准,,,,
明阳阳江青洲四海上风电场项目,风电,,,500,111.5999401,21.44284613,核准,,,,
辰能双鸭山饶河大顶子山风电49.5MW工程项目,风电,,,49.5,134.0167,46.8,并网,黑龙江省,赤峰市,克什克腾旗,经棚镇
明阳清水河县韭菜庄50MW风电供热项目,风电,2019/12/13,2019,50,111.7213419,40.82453779,核准,内蒙古自治区,呼和浩特市,赛罕区,乌兰察布东路街道
明阳揭阳前詹三海上风电场项目（500mw）,风电,,,500,116.48,22.65,核准,,,,
明阳揭阳惠来三海上风电场项目（500mw）,风电,,,500,116.36,22.38,核准,,,,
明阳郏县堂街风电场,风电,,,50,113.233,33.912,核准,河南省,平顶山市,宝丰县,石桥镇
辰能佳木斯富锦风电一期24.3MW工程项目,风电,2004/12/1,2004,24.3,132.05,47.4167,并网,黑龙江省,桂林市,恭城瑶族自治县,嘉会镇
明阳广东瑞德兴阳嘉峪关49.5兆瓦并网光伏发电项目一期15兆瓦项目,光伏,,,15,98.2121264,39.74667728,核准,甘肃省,嘉峪关市,,峪泉镇
明阳大通湖智能5.44万千瓦风电项目,风电,,,54.4,112.4512306,28.5963742,规划,湖南省,益阳市,赫山区,兰溪镇
辰能佳木斯富锦风电三期48MW工程项目,风电,2009/3/31,2009,48,132.05,47.4167,并网,黑龙江省,沧州市,黄骅市,羊二庄回族乡
明阳北林区兴福二龙分散式风电项目,风电,,,8,126.9792842,46.63536821,核准,黑龙江省,绥化市,北林区,北林街道
明阳北林区新华乡分散式风电项目,风电,,,2,126.9856303,46.63728707,核准,黑龙江省,绥化市,北林区,吉泰街道
明阳北林区四方台镇分散式风电项目,风电,,,2,126.9672842,46.62876,核准,黑龙江省,绥化市,北林区,北林街道
明雅中塘镇万家码头38MWp渔光互补光伏发电项目,光伏,,,38,117.1658,39.0357,规划,天津市,天津市,西青区,李七庄街道
明雅中塘镇马圈村72MWp渔光互补光伏发电项目,光伏,,,72,117.9933,39.555,规划,河北省,唐山市,丰南区,南孙庄乡
明水县育林分散式风电项目,风电,,,2,125.9124513,47.17937212,核准,黑龙江省,绥化市,明水县,明水镇
明瑞联盟村222MWp渔光互补光伏发电项目,光伏,,,222,117.1668,39.0497,规划,天津市,天津市,西青区,李七庄街道
辰能佳木斯富锦风电二期18MW工程项目,风电,2008/3/31,2008,18,132.05,47.4167,并网,黑龙江省,合肥市,长丰县,吴山镇
察右中旗大板梁风电场250MW风电项目一期50MW风电清洁供暖项目,风电,2018/6/18,2018,250,112.4833333,41.3,并网,内蒙古自治区,福州市,晋安区,寿山乡
察右前旗航天日泽新能源开发有限公司5万千瓦风电供热项目,风电,2017/12/31,2017,50,113.45,40.9,并网,内蒙古自治区,莆田市,涵江区,江口镇
察右后旗万德泉风电场二期4.95万千瓦风电项目,风电,2015/5/20,2015,49.5,113.198531,41.441771,并网,内蒙古自治区,福州市,闽侯县,青口镇
苍南鹤顶山风电场,风电,2007/9/1,2007,17.05,120.4,27.5,并网,浙江省,白城市,洮北区,幸福街道
民权县花见新能源科技有限公司民权50MW风电项目,风电,,,50,115.6401501,34.43999667,核准,河南省,商丘市,梁园区,长征街道
民权县胡集乡20MWp光伏发电并网项目,光伏,,,20,115.1656416,34.68512441,规划,河南省,商丘市,民权县,城关镇
民权城北50MW风电项目,风电,,,50,115.1297566,34.73458666,核准,河南省,商丘市,民权县,程庄镇
灿烂故城县风电项目（80MW),风电,2018/12/27,2018,80,115.8666667,37.35,并网,河北省,武威市,民勤县,三雷镇
布尔津风电场,风电,1996/7/1,1996,1.05,88.1167,47.85,并网,新疆维吾尔自治区,武威市,民勤县,红沙岗镇
滨州粤水电沾化滨海一期85MW风电项目,风电,2019/5/30,2019,80,118.09,37.7211,并网,山东省,武威市,民勤县,红沙岗镇
滨州粤水电沾化滨海二期36MW风电项目,风电,2019/9/28,2019,36,118.09,37.72,并网,山东省,武威市,民勤县,苏武镇
宾阳马王风电场工程,风电,2018/4/19,2018,100,108.8183333,23.11666667,并网,广西壮族自治区,武威市,民勤县,苏武镇
蝙蝠山风电场,风电,2010/2/2,2010,49.5,130.8,46.1833,并网,黑龙江省,武威市,民勤县,三雷镇
北屯市枫煜风能十师186团49.5MW风电项目,风电,2018/12/1,2018,49.5,87.6346,43.4657,并网,新疆维吾尔自治区,海西蒙古族藏族自治州,格尔木市,乌图美仁乡
庙前镇东分散式风电项目,风电,,,12,111.22031,35.14136,核准,山西省,运城市,夏县,瑶峰镇
渑池县张村镇马头山13.2MW分散式风电项目,风电,,,13.2,111.7834,34.790537,核准,河南省,三门峡市,渑池县,仰韶镇
渑池荆庄风电场项目,风电,,,100,111.8498,34.6911,建设,河南省,三门峡市,渑池县,天池镇
北流望江风电项目,风电,2018/9/30,2018,49.9,110.55,22.38333333,并网,广西壮族自治区,三门峡市,渑池县,果园乡
北流清湾风电场工程,风电,2019/12/2,2019,37,110.334795,22.71141237,并网,广西壮族自治区,凉山彝族自治州,西昌市,响水乡
密山兴凯湖滨知一镇（智一）风电项目,风电,,,49.5,132.0167,45.4833,核准,黑龙江省,鸡西市,密山市,知一镇
密山兴凯湖滨风电场项目,风电,,,49.5,132.1167,45.5333,核准,黑龙江省,鸡西市,密山市,柳毛乡
密山市柳西毛分散式风电场（密山）,风电,,,3,132.1456,45.5765,规划,黑龙江省,鸡西市,密山市,柳毛乡
北流隆盛风电场（二期）,风电,2019/5/10,2019,44,110.6166667,22.51666667,并网,广西壮族自治区,鸡西市,密山市,兴凯湖乡
北流大冲山风电场二期工程,风电,2017/11/1,2017,49.6,110.6333333,22.23333333,并网,广西壮族自治区,驻马店市,泌阳县,郭集镇
北控清洁能源集团有限公司风电供热配套50MW风力发电项目,风电,2019/4/8,2019,50,105.7353805,38.8577611,并网,内蒙古自治区,红河哈尼族彝族自治州,蒙自市,芷村镇
密山光伏电站,光伏,,,10,131.8395859,45.5297013,核准,黑龙江省,鸡西市,密山市,密山镇
泌阳县王店镇50MW风电场项目,风电,,,50,113.9383053,32.98055808,规划,河南省,驻马店市,驿城区,刘阁街道
泌阳清芸阳光100MW光伏农业项目（一期50MW),光伏,,,100,113.3996959,32.80457441,核准,河南省,驻马店市,泌阳县,杨家集镇
汨罗市鹤巢湖20MW渔光互补光伏发电项目,光伏,,,20,112.5216232,29.523234,规划,湖南省,岳阳市,华容县,章华镇
米家垣分散式风电项目,风电,,,8,112.0367,35.9367,核准,山西省,临汾市,浮山县,寨圪塔乡
北京中科捷高张北郝家营乡风电场,风电,2019/12/6,2019,100,114.726375,41.164944,并网,河北省,大理白族自治州,弥渡县,弥城镇
弥渡县朱坊后山农光互补光伏电站项目,光伏,,,50,100.55,25.31666667,核准,云南省,大理白族自治州,弥渡县,寅街镇
孟县西潘风电场三期工程,风电,,,30,113.54647,37.82004,核准,山西省,阳泉市,平定县,冶西镇
北京许继平顶山汝州后坡风电场项目,风电,2020/7/16,2020,50,112.9281,34.2632,并网,河南省,普洱市,孟连傣族拉祜族佤族自治县,娜允镇
孟连芒信永前光伏农业生态园建设项目,光伏,,,20,99.47061177,22.28796463,规划,云南省,普洱市,孟连傣族拉祜族佤族自治县,勐马镇
孟津县小浪底镇50MW风电项目,风电,,,50,112.4881036,34.69403006,核准,河南省,洛阳市,老城区,东北隅街道
包头金源巴润30MW分散式风力发电项目,风电,2017/1/25,2017,30,109.2666667,41.23333333,并网,内蒙古自治区,襄阳市,宜城市,南营街道
勐糯并网光伏电站,光伏,,,30,98.68884552,24.58680702,核准,云南省,保山市,龙陵县,龙山镇
百万千瓦风电基地中广核乌兰4号风电场20万千瓦风电项目,风电,,,200,106.7327,41.54,并网,内蒙古自治区,西双版纳傣族自治州,勐海县,勐海镇
百万千瓦风电基地华能乌兰伊力更1号风电场20万千瓦风电项目,风电,,,200,108.88,42.1967,并网,内蒙古自治区,红河哈尼族彝族自治州,屏边苗族自治县,新华乡
百万千瓦风电基地华电乌兰伊力更2号风电场20万千瓦风电项目,风电,,,200,108.2365,41.9753,并网,内蒙古自治区,红河哈尼族彝族自治州,蒙自市,草坝镇
巴彦双鸭山风电场,风电,,,49.5,127.45,46.4,并网,黑龙江省,临沂市,蒙阴县,蒙阴街道
蒙能伊和乌素风电场二期,风电,,,49.5,101.4,25.7,核准,云南省,楚雄彝族自治州,大姚县,金碧镇
蒙能东苏巴彦杭盖300MW风力发电工程项目,风电,,,300,113.63468,43.82094,核准,内蒙古自治区,锡林郭勒盟,苏尼特左旗,满都拉图镇
蒙力新能源科技有限公司新巴尔虎左旗4万千瓦光伏发电项目,光伏,,,40,118.2625015,48.21810771,核准,内蒙古自治区,呼伦贝尔市,新巴尔虎左旗,阿木古郎镇
巴彦淖尔市能德风电有限公司乌拉特中旗新忽热10MW分散式风电项目,风电,2019/9/12,2019,10,109.684,42.503,并网,内蒙古自治区,兴安盟,科尔沁右翼中旗,巴彦呼舒镇
奥陆嘉白城洮北宝山风电一期49.5MW工程项目,风电,2011/6/20,2011,49.5,122.9917,45.7917,并网,吉林省,通辽市,扎鲁特旗,阿日昆都楞镇
鞍钢营口鲅鱼圈风电6MW工程项目,风电,2009/1/1,2009,6,122.1167,40.2667,并网,辽宁省,亳州市,蒙城县,坛城镇
蒙城昌盛日电太阳能科技有限公司20兆瓦光伏农业科技大棚电站项目,光伏,,,20,116.5628,33.38333333,规划,安徽省,亳州市,蒙城县,坛城镇
安尚通辽科左后旗甘旗卡镇呼勒斯台嘎查分布式风电3MW工程项目,风电,2016/10/28,2016,3,122.4,42.9333,并网,内蒙古自治区,呼伦贝尔市,扎赉诺尔区,第五街道
美光铜川印台区50兆瓦光伏发电项目,光伏,,,50,109.1833333,35.7,核准,陕西省,延安市,黄陵县,隆坊镇
阿拉善盟额济纳旗分散式风电一期30MW工程项目,风电,2016/2/1,2016,30,98.3457,42.423,并网,内蒙古自治区,梅州市,梅江区,城北镇
UPC泰安肥城刘台风电49.5MW工程项目,风电,2017/12/5,2017,49.5,116.6766394,36.22372999,并网,山东省,梅州市,梅县区,丙村镇
梅里斯小八旗村分散式风场,风电,,,2,123.91796,47.35431,核准,黑龙江省,齐齐哈尔市,建华区,文化街道
梅里斯曙光风电场56.1MW平价上网风力发电项目,风电,,,56.1,123.759541,47.31555,规划,黑龙江省,齐齐哈尔市,梅里斯达斡尔族区,梅里斯街道
邹城赛维煤炭塌陷区光伏生态园二期20兆瓦光伏发电项目,光伏,,,20,117.0565117,35.48062072,并网,山东省,楚雄彝族自治州,大姚县,赵家店镇
漫岩分散式风电项目,风电,,,6,111.9323585,38.35882846,核准,山西省,忻州市,静乐县,鹅城镇
综艺（克州）新能源乌恰20MW光伏发电项目,光伏,2013/12/29,2013,20,75.25526667,39.68333333,并网,新疆维吾尔自治区,呼伦贝尔市,扎赉诺尔区,第五街道
淄博中阳太阳能科技寨里20MW光伏发电项目,光伏,2015/12/31,2015,20,117.9997724,36.69152149,并网,山东省,呼伦贝尔市,扎赉诺尔区,第五街道
淄博太奇10MW光伏发电建设项目,光伏,2016/8/19,2016,10,118.1174708,37.03206062,并网,山东省,呼伦贝尔市,扎赉诺尔区,第五街道
淄博汇祥新能源有限公司高青“渔光结合”20MW光伏发电项目,光伏,2017/5/25,2017,20,117.8323916,37.19687696,并网,山东省,喀什地区,麦盖提县,希依提敦乡
淄博光合新能源有限公司昆仑20兆瓦光伏发电项目,光伏,2016/6/28,2016,20,118.0224574,36.72576743,并网,山东省,甘南藏族自治州,玛曲县,欧拉镇
马斯特盐池风电场（大水坑杨儿庄）项目,风电,,,49.4,107.423017,37.73434,核准,宁夏回族自治区,吴忠市,盐池县,花马池镇
马斯特盐池风电场（大水坑摆宴井）,风电,,,49.4,108.3667,23.5833,核准,广西壮族自治区,南宁市,马山县,古零镇
涿鹿县张家堡20兆瓦光伏并网发电项目,光伏,2017/12/31,2017,20,115.1833333,40.46666667,并网,河北省,南宁市,马山县,乔利乡
追日电气天门渔薪20MWp地面光伏电站,光伏,2016/3/28,2016,20,113.2281965,30.76164379,并网,湖北省,南宁市,马山县,白山镇
庄浪光原光伏发电20MW光伏发电项目,光伏,2017/6/26,2017,20,105.1,35.86666667,并网,甘肃省,南宁市,马山县,白山镇
马山苏仅风电场工程,风电,,,60,108.2302062,23.70208014,核准,广西壮族自治区,南宁市,马山县,白山镇
马鸣乡风电场,风电,,,36,105.2491655,31.65306744,核准,四川省,绵阳市,梓潼县,马鸣镇
朱巷镇七里村20MW光伏发电项目,光伏,2015/12/31,2015,20,117.1962896,32.53333333,并网,安徽省,平顶山市,鲁山县,梁洼镇
忠县100兆瓦光伏电站项目,光伏,2017/6/27,2017,100,107.7563333,30.33883333,并网,重庆市,曲靖市,马龙区,王家庄街道
中长电力仙桃胡场20MW农光互补发电项目,光伏,2019/11/23,2019,20,113.5325631,30.37594107,并网,湖北省,曲靖市,马龙区,王家庄街道
马龙天合曲靖马龙大山50MW光伏电站发电项目,光伏,,,50,103.45,25.33333333,核准,云南省,曲靖市,马龙区,旧县街道
马口分散式风电项目,风电,,,6,113.2999693,40.07633698,核准,山西省,大同市,平城区,向阳里街道
马家分散式风电项目,风电,,,12,111.0567,35.33,核准,山西省,运城市,盐湖区,上王乡
马家变分散式风电项目,风电,,,5,125.13415,46.56182,核准,黑龙江省,大庆市,龙凤区,三永街道
马钢集团南山矿业有限责任公司城门峒废弃尾矿库综合利用一期20MW光伏发电项目,光伏,,,20,118.505597,31.687745,规划,安徽省,马鞍山市,雨山区,雨山街道
马钢集团南山矿业有限责任公司城门峒废弃尾矿库综合利用二期20MW光伏发电项目,光伏,,,20,118.505597,31.687745,规划,安徽省,马鞍山市,雨山区,雨山街道
中兴源光喀什叶城30兆瓦光伏并网发电项目,光伏,2015/8/30,2015,30,77.41,37.747,并网,新疆维吾尔自治区,哈尔滨市,依兰县,宏克力镇
麻章区太平镇50MW渔光互补发电项目,光伏,,,50,110.340579,21.269189,核准,广东省,湛江市,麻章区,麻章镇
麻栗坡县50MW农光互补光伏发电项目,光伏,,,50,104.7001884,23.12525197,规划,云南省,文山壮族苗族自治州,麻栗坡县,麻栗镇
中兴能源源兴喀什叶城30兆瓦集中式发电项目,光伏,2016/7/23,2016,30,77.41,37.754,并网,新疆维吾尔自治区,黔东南苗族侗族自治州,凯里市,碧波镇
中兴能源源光克州阿图什40兆瓦光伏并网发电项目,光伏,2016/6/28,2016,40,75.88333333,39.76666667,并网,新疆维吾尔自治区,信阳市,新县,田铺乡
中祥连云港20MWp并网光伏电站项目,光伏,2014/12/31,2014,20,118.95,34.5,并网,江苏省,洛阳市,宜阳县,樊村镇
中卫正泰迎水桥20MWp光伏电站项目,光伏,2013/12/31,2013,20,105.1666667,37.51666667,并网,宁夏回族自治区,黄冈市,麻城市,阎家河镇
麻城蔡家寨风电场二期（40MW）项目,风电,,,40,115.0394905,31.16133753,核准,湖北省,黄冈市,麻城市,南湖办事处
绿洲牡丹江爱民区25MWp光伏电站项目,光伏,,,25,129.4333333,44.68333333,核准,黑龙江省,牡丹江市,爱民区,北安街道
中卫云基地光伏电站项目,光伏,2015/12/1,2015,130,105.1932045,37.4999433,并网,宁夏回族自治区,安阳市,内黄县,东庄镇
中卫银阳盛腾喀什疏勒20MW光伏发电项目,光伏,2015/8/31,2015,20,76.13333333,39.22,并网,新疆维吾尔自治区,遵义市,播州区,桂花桥街道
中卫市振发寺口光伏电力沙坡头10MW光伏发电项目,光伏,2013/12/31,2013,10,105.4666667,37.33333333,并网,宁夏回族自治区,南宁市,西乡塘区,安吉街道
中卫市振发沙漠光伏发电沙坡头二期30MW光伏发电项目,光伏,2013/12/31,2013,30,105.3333333,37.51666667,并网,宁夏回族自治区,昆明市,寻甸回族彝族自治县,凤合镇
中卫市振发沙漠光伏发电沙坡头20MW光伏发电项目,光伏,2013/12/31,2013,20,105.3333333,37.51666667,并网,宁夏回族自治区,张家口市,张北县,馒头营乡
绿巨人张北云计算基地绿色数据中心新能源微电网示范项目120MW风电,风电,,,120,114.6257,41.2763,核准,河北省,张家口市,张北县,馒头营乡
绿金淮北濉溪县百善镇分散式风电项目,风电,,,15,116.677,33.78,核准,安徽省,淮北市,濉溪县,百善镇
绿匠南乐分散式风电场项目,风电,,,35,115.2,36.069,核准,河南省,濮阳市,南乐县,城关镇
中天光伏技术9.6MW光伏发电项目,光伏,2013/12/24,2013,9.6,118.7666667,32.25,并网,江苏省,无锡市,江阴市,临港街道
中盛莘县20兆瓦菌菇科技大棚光伏并网发电项目,光伏,2015/9/3,2015,20,115.7113519,36.27399683,并网,山东省,无锡市,江阴市,临港街道
绿川新能源光伏电站项目,光伏,,,35,115.9541492,28.57910059,规划,江西省,南昌市,南昌县,莲塘镇
吕梁市离石区薛公岭50MW风电场工程,风电,,,50,111.5833333,37.46666667,核准,山西省,吕梁市,文水县,开栅镇
吕梁岚县顺县4.8万千瓦风电项目,风电,,,48,115.65,22.95,核准,广东省,汕尾市,陆丰市,东海街道
洛阳宜阳风光互补电站樊村光伏发电工程,光伏,,,30,112.2598146,34.61348929,核准,河南省,洛阳市,宜阳县,香鹿山镇
中盛成武农业科技大棚20兆瓦光伏发电项目,光伏,2016/3/31,2016,20,115.9261806,35.00871835,并网,山东省,洛阳市,宜阳县,城关镇
洛阳宜阳樊村风电场工程,风电,,,48,112.16,34.51,核准,河南省,洛阳市,宜阳县,锦屏镇
洛阳尚德宜阳赵堡镇一期20MWp地面光伏电站项目,光伏,,,20,112.2445108,34.62259895,核准,河南省,洛阳市,宜阳县,香鹿山镇
洛阳光隆贵科技有限公司伊川大禹山20MWp太阳能光伏电站,光伏,,,20,112.4524725,34.47417244,核准,河南省,洛阳市,伊川县,城关街道
洛阳赋骁风力发电有限公司新安县石井镇6MW分散式风电场,风电,,,6,112.14,34.75,核准,河南省,洛阳市,新安县,城关镇
洛阳赋骁风力发电有限公司孟津县横水镇分散式风力发电项目,风电,,,6,112.43,34.83,核准,河南省,洛阳市,孟津县,城关镇
中晟微山采煤沉陷区50MW光伏发电示范项目,光伏,2017/6/30,2017,50,117.1426948,34.81414096,并网,山东省,洛阳市,洛宁县,城郊乡
洛宁县中建材浚鑫光伏发电有限公司二期18MW光伏发电项目,光伏,,,18,111.6645762,34.40657727,规划,河南省,洛阳市,洛宁县,城关镇
中宁县振发光伏电力中宁枣园二期10MW农业一体化光伏发电项目,光伏,2015/9/22,2015,10,105.4166667,37.91666667,并网,内蒙古自治区,洛阳市,洛宁县,城郊乡
洛宁上岭4.8万千瓦一期风电项目,风电,,,40,111.3740162,34.225,核准,河南省,洛阳市,洛宁县,下峪镇
螺蛳壳风电场,风电,,,49.5,107.6132622,26.35581062,核准,贵州省,黔东南苗族侗族自治州,麻江县,贤昌镇
萝北县云山石墨矿分散式风电项目,风电,,,24,106.9257,28.9789,规划,重庆市,重庆市,綦江区,万东镇
萝北县石墨园区产业园分散式风力发电项目,风电,,,36,106.9453,28.9408,规划,重庆市,重庆市,綦江区,万东镇
罗山县延生农牧养殖有限公司罗山光伏电站项目,光伏,,,18.4,90.41666667,32,核准,西藏自治区,那曲市,班戈县,佳琼镇
罗山县邵湾14MW分散式风电场,风电,,,14,114.4940199,32.22616332,核准,河南省,信阳市,罗山县,尤店乡
罗山县方湾16MW分散式风电场,风电,,,16,114.4349916,32.16440773,核准,河南省,信阳市,罗山县,楠杆镇
中宁县振发光伏电力中宁枣园20MW光伏发电项目,光伏,2015/9/22,2015,20,105.4166667,37.91666667,并网,内蒙古自治区,大理白族自治州,洱源县,三营镇
中宁县兴业锦绣新能源有限公司中宁县100MW光伏发电项目,光伏,2017/6/30,2017,100,105.75,37.65,并网,宁夏回族自治区,黔南布依族苗族自治州,罗甸县,龙坪镇
中宁隆基天华余丁乡20MWp光伏电站项目,光伏,2015/1/14,2015,20,105.5,37.53333333,并网,宁夏回族自治区,承德市,滦平县,张百湾镇
中宁隆基光伏新能源有限公司喊叫水200MW光伏发电项目,光伏,2017/6/26,2017,200,105.6809408,37.49150548,并网,宁夏回族自治区,承德市,滦平县,张百湾镇
滦平天宏100兆瓦风电场项目,风电,,,100,117.33286,40.94145,核准,河北省,承德市,滦平县,中兴路街道
中能桑普阿克塞县科技有限公司阿克塞20兆瓦并网光伏发电项目,光伏,2013/7/20,2013,20,94.25,39.6,并网,甘肃省,承德市,滦平县,金沟屯镇
中能华辰沂源20兆瓦光伏发电项目,光伏,2016/12/16,2016,20,118.2355645,36.19026632,并网,山东省,承德市,隆化县,中关镇
中闽十三师红星二场一期20MW光伏发电项目,光伏,2015/12/31,2015,20,93.21666667,42.85,并网,新疆维吾尔自治区,承德市,滦平县,红旗镇
露天煤业内蒙古通辽市100万千瓦风电外送项目,风电,,,1000,122.167969,44.33269,核准,内蒙古自治区,兴安盟,科尔沁右翼中旗,好腰苏木镇
中民新能敖伦布拉格50MWp并网光伏发电项目,光伏,2016/6/30,2016,50,106.1,40.31666667,并网,内蒙古自治区,阿拉善盟,阿拉善左旗,巴彦诺日公苏木
潞河分散式风电项目,风电,,,14,113.24893,36.35418,核准,山西省,长治市,潞城区,潞华街道
潞城市黄牛蹄风电项目,风电,,,50,113.1398662,36.14791673,核准,山西省,长治市,潞州区,五马街道
中民投盐池200兆瓦光伏发电项目,光伏,2019/12/26,2019,200,121.022575,30.682241,并网,浙江省,楚雄彝族自治州,禄丰县,碧城镇
鹿寨黄冕风电场,风电,,,50,109.7678527,24.51704833,规划,广西壮族自治区,柳州市,鹿寨县,鹿寨镇
鹿邑县风易发电有限公司穆店20MW分散式项目,风电,,,20,115.4833333,33.908,核准,河南省,周口市,鹿邑县,涡北镇
鹿邑县风尚发电有限公司50MW风电项目,风电,,,50,114.6767558,33.57180593,规划,河南省,周口市,商水县,城关乡
中民投同心光伏发电项目,光伏,2015/10/11,2015,200,105.9100266,36.98050057,并网,宁夏回族自治区,商丘市,柘城县,安平镇
陆良雨补村40MW光伏电站发电项目,光伏,,,40,103.6333333,25.21666667,核准,云南省,曲靖市,陆良县,芳华镇
陆良县罗贡50MWp生态农业光伏发电项目,光伏,,,50,103.5158333,24.97583333,核准,云南省,曲靖市,陆良县,小百户镇
陆良县大莫古麻舍所30MW林光互补项目,光伏,,,30,103.5666667,24.88333333,核准,云南省,曲靖市,陆良县,大莫古镇
陆丰市桥冲镇100MW渔光互补光伏电站,光伏,,,100,115.755515,22.913891,核准,广东省,汕尾市,陆丰市,桥冲镇
中民投宁夏盐池光伏发电380MWp项目,光伏,2016/6/28,2016,380,106.9833333,37.96666667,并网,宁夏回族自治区,汕尾市,陆丰市,潭西镇
中利腾晖海南电力有限公司共和四期50兆瓦并网光伏发电项目,光伏,2015/12/31,2015,50,100.9833333,36.6,并网,青海省,汕尾市,海丰县,公平镇
陆丰市富炜城100MW渔光一体化光伏发电项目,光伏,,,100,115.65849,22.923636,核准,广东省,汕尾市,陆丰市,东海街道
陆丰甲湖风电场扩建工程,风电,,,48,115.4296494,23.06785241,核准,广东省,汕尾市,海丰县,公平镇
中利腾晖光伏科技有限公司常熟市9.8MW农业大棚光伏发电项目,光伏,2013/12/30,2013,9.8,120.75,31.65,并网,江苏省,汕尾市,海丰县,平东镇
陆丰宝丽华甲湖湾后湖海上风电场一期项目,风电,,,500,115.54,22.55,规划,,,,
陆丰宝丽华甲湖湾后湖海上风电场二期项目,风电,,,900,115.54,22.56,规划,,,,
陆川凤凰岭风电场工程,风电,,,99,110.2159296,22.32809586,核准,广西壮族自治区,玉林市,陆川县,沙湖镇
鲁山县汝风新能源科技有限公司鲁山团城分散式风电项目,风电,,,20,112.86,33.72,核准,河南省,平顶山市,鲁山县,董周乡
鲁山县汝风新能源科技有限公司鲁山鲁山坡分散式风电项目,风电,,,20,112.91,33.75,核准,河南省,平顶山市,鲁山县,琴台街道
鲁山县汝风新能源科技有限公司鲁山李子峪分散式风电项目,风电,,,20,112.89,33.74,核准,河南省,平顶山市,鲁山县,董周乡
鲁能沾化48MW风电项目,风电,,,48,118.04,37.74,核准,山东省,滨州市,沾化区,下洼镇
中利腾晖光伏科技有限公司9.8MW鱼塘水面光伏电站项目,光伏,2013/9/12,2013,9.8,120.75,31.65,并网,江苏省,榆林市,靖边县,海则滩镇
中利腾晖共和新能源三期50MW光伏发电项目,光伏,2013/12/30,2013,50,100.5266667,36.2842453,并网,青海省,吐鲁番市,高昌区,老城路街道
中利腾晖共和新能源二期100MW光伏发电项目,光伏,2013/12/31,2013,100,100.5983333,36.2122453,并网,青海省,榆林市,定边县,白湾子镇
中利腾晖共和光伏发电20MW光伏发电项目,光伏,2013/9/18,2013,20,100.5666667,36.2982453,并网,青海省,张家口市,康保县,康保镇
中利腾晖（嘉峪关）光伏发电100MW光伏发电项目,光伏,2013/6/15,2013,100,98.16,39.8,并网,甘肃省,威海市,乳山市,城区街道
中科蓝天百灵庙风电场10MWp太阳能光伏发电项目,光伏,2016/5/29,2016,10,110.3666667,41.58333333,并网,内蒙古自治区,东营市,河口区,河口街道
中科恒源国新喀什塔什库尔干20兆瓦光伏并网发电项目,光伏,2016/6/28,2016,20,75.22163607,37.77298702,并网,新疆维吾尔自治区,承德市,丰宁满族自治县,黄旗镇
鲁基风电场,风电,,,49.5,102.4198204,28.27445057,核准,四川省,凉山彝族自治州,喜德县,光明镇
庐山市沙岭二期分散式风电项目,风电,,,20,116.0208333,29.33333333,核准,江西省,九江市,庐山市,蓼南乡
中科恒源（玉门）新能源科技有限公司20兆瓦光伏发电项目,光伏,2016/6/30,2016,20,97.83333333,40.81666667,并网,甘肃省,芜湖市,无为市,昆山镇
庐江县晶科光伏发电有限公司泥河镇20MW农光互补光伏电站项目,光伏,,,20,117.3,31.01666667,核准,安徽省,合肥市,庐江县,罗河镇
